PostId,PostUrl,PostEngagement,Platform,ChannelID,ChannelName,ChannelUid,ChannelUrl,ChannelEngagement,post_body_text,GoogleAudioText,VoskAudioText,EmbeddedContentText,published_at,post_data,post_media_urls,LikesCount,SharesCount,CommentsCount,ViewsCount,post_media_file,embedded_post_text,search_data
38872811,https://www.facebook.com/13310147298/posts/10160232820177299,,Facebook,1172477,The Atlanta Journal-Constitution,blank_for_now,blank_for_now,"{""follower_count"":847497,""following_count"":0,""like_count"":1944,""post_count"":40,""views_count"":0,""comment_count"":1396,""share_count"":null}","For this episode of our Atlanta Culinary Journeys series, sponsored by Kroger, Chef John met up with Belén de la Cruz to make her signature Argentinian beef empanadas. Read more: https://www.ajc.com/things-to-do/food-and-recipes/belen-de-la-cruz-puts-plenty-of-passion-into-her-empanadas/UID5E4BS3JER7IO4UIKJDPNW4I/",,no longer populated,,2022-05-28T17:00:02.000Z,post data removed,https://www.junkipedia.org/rails/active_storage/blobs/eyJfcmFpbHMiOnsibWVzc2FnZSI6IkJBaHBCRWQ3TlFFPSIsImV4cCI6bnVsbCwicHVyIjoiYmxvYl9pZCJ9fQ==--60424d83927b97c904ae900fd491298609c6b44e/post-1172477-38872811-thumbnail,3,0,0,0,,
38807318,https://www.facebook.com/13310147298/posts/10160231636332299,,Facebook,1172477,The Atlanta Journal-Constitution,blank_for_now,blank_for_now,"{""follower_count"":847497,""following_count"":0,""like_count"":1944,""post_count"":40,""views_count"":0,""comment_count"":1396,""share_count"":null}","In the first episode of our Atlanta Culinary Journeys series, sponsored by Kroger, food & dining editor Ligaya Figueras visits Belén de la Cruz at her Argentinian empanadas shop in Johns Creek Read more: https://www.ajc.com/things-to-do/food-and-recipes/belen-de-la-cruz-puts-plenty-of-passion-into-her-empanadas/UID5E4BS3JER7IO4UIKJDPNW4I/",,no longer populated,,2022-05-27T23:30:04.000Z,post data removed,https://www.junkipedia.org/rails/active_storage/blobs/eyJfcmFpbHMiOnsibWVzc2FnZSI6IkJBaHBCRDJYTkFFPSIsImV4cCI6bnVsbCwicHVyIjoiYmxvYl9pZCJ9fQ==--7a3055e646bfd4cca92fdcd7e94a1757cb94f5ae/post-1172477-38807318-thumbnail,2,1,1,0,,
27304945,https://www.facebook.com/251414708394338/posts/688073475879808,,Facebook,1119578,Positively Osceola,blank_for_now,blank_for_now,"{""follower_count"":52298,""following_count"":0,""like_count"":631,""post_count"":29,""views_count"":0,""comment_count"":191,""share_count"":220}","Good Morning Osceola with Krissi 🌞 Topics Include: *Governor Ron DeSantis Approves $800M in Florida's Budget for Teacher Raises *Osceola County Announces FREE Tuition for 2022 Graduates Attending Valencia College *Creative Inspiration Journey School to Host Community Informational Tour *Recall Alert! Walmart & Kroger Pancake Mix Due to Possible ""Cable Fragments"" *Going Solar? Kissimmee Utility Authority Can Help! *Local Green Atlanta Pulls Food Truck into Disney Springs * Race to the Taste Fundraiser at OHP *Weather #GoodMorningOsceola #OsceolaNews #OsceolaWeather",,no longer populated,,2022-03-23T11:30:13.000Z,post data removed,,1,0,2,0,,
64130962,https://www.tiktok.com/@tom_vertabrate/video/7075281848267558190,,TikTok,7601946,Thomas Moore,blank_for_now,blank_for_now,"{""follower_count"":null,""following_count"":null,""like_count"":null,""post_count"":null,""views_count"":null,""comment_count"":null,""share_count"":null}",#greenscreen Kroger has evolved over the years!!! @kroger #kroger #trends #viral #trending #reactions #tiktokviral #tiktok #modern #models #fy #fyp #foryou #foryoupage #fypage #fypシ #grocerystore #groceries #history #blowthisup #blackcreators #explore #discover #didyouknow #share #follow #popular #food #supermarket #produce #promote #atl #atlanta #ga #Georgia #godfirst #faith #trust #believe #reactions, ,no longer populated,,2022-03-15T11:07:10.000Z,post data removed,https://www.junkipedia.org/rails/active_storage/blobs/eyJfcmFpbHMiOnsibWVzc2FnZSI6IkJBaHBCTW1Na1FJPSIsImV4cCI6bnVsbCwicHVyIjoiYmxvYl9pZCJ9fQ==--ae13e09046a1e5b354cf041a167147dc02c5b6f4/post-7601946-64130962-thumbnail,4054,12,83,70858,https://www.junkipedia.org/rails/active_storage/blobs/eyJfcmFpbHMiOnsibWVzc2FnZSI6IkJBaHBCTkdNa1FJPSIsImV4cCI6bnVsbCwicHVyIjoiYmxvYl9pZCJ9fQ==--221159958549704745067ca15f04efcce66eecfa/08030b8228a74161876b3145ad102a1b,
375492043,https://www.facebook.com/photo/?fbid=1259524900783401&set=a.130808090321760,,Facebook,21097368,JTG Daugherty Racing,blank_for_now,blank_for_now,"{""follower_count"":27284,""following_count"":0,""like_count"":30376,""post_count"":150,""views_count"":0,""comment_count"":1897,""share_count"":1177}","Race weekend Atlanta Motor Speedway has officially begun! 

AJ Allmendinger used Kroger #ClickList to order groceries online and pick up from the store, but forgot food for Mr. Tickles! Mr. Tickles took matters into his own hands...", ,no longer populated,,2017-03-04T16:45:06.000Z,post data removed,,75,6,4,0,,
